{
  "$schema": "./schema/ktuluekit-migration.schema.json",
  "version": "1.0",
  "metadata": {
    "name": "KtulueKit Migration",
    "author": "Ktulue",
    "description": "Personal state restoration for a fresh Windows 11 install. Copies app profiles, configs, and media from a backup location to the correct W11 paths.",
    "repository": "https://github.com/Ktulue/KtulueKit-Migration"
  },
  "backup_root": "D:\\KtulueBackup",
  "apps": [
    {
      "name": "OBS Studio",
      "category": "Streaming",
      "items": [
        {
          "label": "scenes & profiles",
          "source": "obs-studio/basic",
          "target": "%APPDATA%/obs-studio/basic",
          "description": "Scene collections and profile configurations",
          "notes": "Close OBS before backing up to avoid file locks. Scenes stored as JSON in %APPDATA%/obs-studio/basic/scenes/"
        },
        {
          "label": "plugin configs",
          "source": "obs-studio/plugin_config",
          "target": "%APPDATA%/obs-studio/plugin_config",
          "description": "Third-party plugin configuration data"
        }
      ]
    },
    {
      "name": "Streamer.bot",
      "category": "Streaming",
      "items": [
        {
          "label": "actions & commands",
          "source": "streamerbot/data",
          "target": "%APPDATA%/Streamer.bot/data",
          "description": "Actions, commands, and automation database",
          "notes": "Close Streamer.bot before backing up to avoid SQLite file locks on .db files"
        },
        {
          "label": "settings",
          "source": "streamerbot/settings",
          "target": "%APPDATA%/Streamer.bot/settings",
          "description": "Application settings and connection configs"
        }
      ]
    },
    {
      "name": "Stream Deck",
      "category": "Streaming",
      "items": [
        {
          "label": "profiles & icons",
          "source": "streamdeck/ProfilesV2",
          "target": "%APPDATA%/Elgato/StreamDeck/ProfilesV2",
          "description": "Stream Deck button layouts, pages, and custom icons"
        }
      ]
    },
    {
      "name": "Brave Browser",
      "category": "Browser & Identity",
      "items": [
        {
          "label": "user profile",
          "source": "brave/User Data/Default",
          "target": "%LOCALAPPDATA%/BraveSoftware/Brave-Browser/User Data/Default",
          "description": "Bookmarks, history, saved passwords, and settings",
          "notes": "Extensions may need to be re-enabled or reinstalled manually after copy"
        },
        {
          "label": "local state",
          "source": "brave/User Data/Local State",
          "target": "%LOCALAPPDATA%/BraveSoftware/Brave-Browser/User Data/Local State",
          "description": "Browser-level settings and profile metadata"
        }
      ]
    },
    {
      "name": "GIFs & Media Assets",
      "category": "Media Assets",
      "items": [
        {
          "label": "stream media",
          "source": "media/stream-assets",
          "target": "%USERPROFILE%/Documents/StreamAssets",
          "description": "GIFs, overlays, alert media, and other streaming visuals"
        }
      ]
    },
    {
      "name": "PowerShell",
      "category": "Shell & Terminal",
      "items": [
        {
          "label": "profile (oh-my-posh)",
          "source": "powershell/Microsoft.PowerShell_profile.ps1",
          "target": "%USERPROFILE%/Documents/PowerShell/Microsoft.PowerShell_profile.ps1",
          "description": "PowerShell profile with oh-my-posh theme configuration"
        }
      ]
    },
    {
      "name": "LurkBait Twitch Fishing",
      "category": "Games",
      "items": [
        {
          "label": "save data & custom catches",
          "source": "lurkbait",
          "target": "%USERPROFILE%/AppData/LocalLow/BLAMCAM Interactive/LurkBait Twitch Fishing",
          "description": "Save data, Twitch connection config, and custom catch images/GIFs",
          "notes": "Includes CatchData, PlayerData, DexData, AppPreferences, connection BINs, and the CustomCatches image folder"
        }
      ]
    },
    {
      "name": "Git",
      "category": "Dev Tools",
      "items": [
        {
          "label": "global config",
          "source": "git/.gitconfig",
          "target": "%USERPROFILE%/.gitconfig",
          "description": "Global git identity, aliases, and default branch settings"
        }
      ]
    },
    {
      "name": "SSH",
      "category": "Dev Tools",
      "items": [
        {
          "label": "keys & config",
          "source": "ssh",
          "target": "%USERPROFILE%/.ssh",
          "description": "SSH keys and config for GitHub and remote connections",
          "notes": "Restore file permissions after copy: id_rsa should be 600"
        }
      ]
    },
    {
      "name": "VS Code",
      "category": "Dev Tools",
      "items": [
        {
          "label": "settings & keybindings",
          "source": "vscode/User",
          "target": "%APPDATA%/Code/User",
          "description": "VS Code settings.json, keybindings.json, and snippets"
        }
      ]
    },
    {
      "name": "Windows Terminal",
      "category": "Dev Tools",
      "items": [
        {
          "label": "settings",
          "source": "terminal/settings.json",
          "target": "%LOCALAPPDATA%/Packages/Microsoft.WindowsTerminal_8wekyb3d8bbwe/LocalState/settings.json",
          "description": "Terminal profiles, color schemes, and keybindings",
          "notes": "Applies only when Terminal is installed via Microsoft Store or WinGet"
        }
      ]
    },
    {
      "name": "GIMP",
      "category": "Creative Suite",
      "items": [
        {
          "label": "brushes & settings",
          "source": "gimp",
          "target": "%APPDATA%/GIMP",
          "description": "GIMP user settings, brushes, and presets"
        }
      ]
    },
    {
      "name": "Krita",
      "category": "Creative Suite",
      "items": [
        {
          "label": "brushes & settings",
          "source": "krita",
          "target": "%APPDATA%/krita",
          "description": "Krita user settings and brush presets"
        }
      ]
    },
    {
      "name": "Audacity",
      "category": "Creative Suite",
      "items": [
        {
          "label": "settings",
          "source": "audacity",
          "target": "%APPDATA%/audacity",
          "description": "Audacity preferences and EQ presets"
        }
      ]
    },
    {
      "name": "Blender",
      "category": "Creative Suite",
      "items": [
        {
          "label": "preferences & addons",
          "source": "blender",
          "target": "%APPDATA%/Blender Foundation",
          "description": "Blender user preferences, themes, and installed addons"
        }
      ]
    },
    {
      "name": "Aseprite",
      "category": "Creative Suite",
      "items": [
        {
          "label": "settings",
          "source": "aseprite",
          "target": "%APPDATA%/Aseprite",
          "description": "Aseprite user settings and palettes"
        }
      ]
    },
    {
      "name": "Kdenlive",
      "category": "Creative Suite",
      "items": [
        {
          "label": "settings",
          "source": "kdenlive",
          "target": "%APPDATA%/kdenlive",
          "description": "Kdenlive user settings and render profiles"
        }
      ]
    },
    {
      "name": "DaVinci Resolve",
      "category": "Creative Suite",
      "items": [
        {
          "label": "project library",
          "source": "resolve",
          "target": "%USERPROFILE%/Documents/DaVinci Resolve",
          "description": "DaVinci Resolve project database and settings"
        }
      ]
    },
    {
      "name": "ShareX",
      "category": "Utilities",
      "items": [
        {
          "label": "settings & screenshots",
          "source": "sharex",
          "target": "%APPDATA%/ShareX",
          "description": "ShareX application settings and screenshot library"
        }
      ]
    },
    {
      "name": "PowerToys",
      "category": "Utilities",
      "items": [
        {
          "label": "settings",
          "source": "powertoys",
          "target": "%LOCALAPPDATA%/Microsoft/PowerToys",
          "description": "PowerToys module settings and keybindings"
        }
      ]
    },
    {
      "name": "Claude Desktop",
      "category": "Utilities",
      "items": [
        {
          "label": "MCP config",
          "source": "claude-desktop",
          "target": "%APPDATA%/Claude",
          "description": "Claude Desktop MCP server configuration"
        }
      ]
    },
    {
      "name": "Discord",
      "category": "Communication",
      "items": [
        {
          "label": "local settings",
          "source": "discord",
          "target": "%APPDATA%/discord",
          "description": "Discord local user settings and keybindings"
        }
      ]
    },
    {
      "name": "Spotify",
      "category": "Communication",
      "items": [
        {
          "label": "local files",
          "source": "spotify",
          "target": "%LOCALAPPDATA%/Spotify",
          "description": "Spotify local cache and downloaded files"
        }
      ]
    },
    {
      "name": "Personal Files",
      "category": "Personal Files",
      "items": [
        {
          "label": "Desktop",
          "source": "personal/Desktop",
          "target": "%USERPROFILE%/Desktop",
          "description": "All files and folders stored on the Desktop",
          "strategy": "mirror"
        },
        {
          "label": "Documents",
          "source": "personal/Documents",
          "target": "%USERPROFILE%/Documents",
          "description": "Documents folder — select specific items via folder picker",
          "strategy": "selective"
        },
        {
          "label": "Videos",
          "source": "personal/Videos",
          "target": "%USERPROFILE%/Videos",